Score,Recommendation,,,,,,,,,,,,,,,,,,,
5,Use a gentle shampoo and conditioner. Consider avoiding heat styling. Stay hydrated and rest. Avoid stress. Image: [image of a gentle shampoo],,,,,,,,,,,,,,,,,,,
10,"Use a mild shampoo and conditioner. Avoid heat treatments for your hair. Focus on hydration. Consume healthy foods like fruits, vegetables, and drink plenty of water. Image: [image of fruits and water]",,,,,,,,,,,,,,,,,,,
15,Incorporate scalp treatments twice a week. Use hair oils like coconut or olive oil. Limit hair styling. Maintain a balanced diet with proteins and vitamins. Image: [image of hair oil],,,,,,,,,,,,,,,,,,,
20,Consider regular scalp massages to improve circulation. Try a deep conditioning hair mask weekly. Include more vitamin-rich foods like eggs and nuts in your diet. Avoid harsh chemical treatments. Image: [image of a hair mask],,,,,,,,,,,,,,,,,,,
25,Add herbal oils like peppermint or lavender to your routine. Avoid chemical hair treatments. Include iron-rich foods such as spinach and beans. Engage in moderate exercise to reduce stress. Image: [image of peppermint leaves],,,,,,,,,,,,,,,,,,,
30,Opt for protein-rich hair masks. Consult with a dermatologist if the problem persists. Increase vitamin D-rich foods like salmon and mushrooms. Try meditation or relaxation techniques to manage stress. Image: [image of salmon],,,,,,,,,,,,,,,,,,,
35,"Consider a complete hair care routine with nourishing oils. Use shampoos with natural ingredients. Add foods rich in zinc like seeds, nuts, and oysters. Sleep 7-8 hours daily and focus on mental well-being. Image: [image of natural shampoo]",,,,,,,,,,,,,,,,,,,
40,Use strengthening treatments to support hair growth. Incorporate biotin into your diet. Include complex carbohydrates like whole grains in your meals. Consult a specialist for advanced treatments if needed. Image: [image of biotin capsules],,,,,,,,,,,,,,,,,,,
45,Focus on hair restoration treatments. Include more leafy greens like kale and broccoli in your diet for iron. Avoid stress and practice regular physical activity to improve overall health. Image: [image of kale],,,,,,,,,,,,,,,,,,,
50,Hair treatments with keratin and protein are beneficial. Add anti-inflammatory foods like turmeric and ginger. Avoid all chemical products and opt for natural alternatives. Drink herbal teas for relaxation. Image: [image of turmeric],,,,,,,,,,,,,,,,,,,
55,Consider consulting a trichologist for personalized advice. Use scalp stimulating products. Eat foods rich in omega-3 like chia seeds and walnuts. Limit processed foods. Image: [image of walnuts],,,,,,,,,,,,,,,,,,,
60,Use salon-grade hair treatments for intense repair. Focus on healthy fats like avocados in your diet. Try stress-reduction techniques like yoga or deep breathing. Consult a specialist if conditions worsen. Image: [image of avocado],,,,,,,,,,,,,,,,,,,
65,Include supplements like biotin and collagen for hair regrowth. Opt for foods rich in antioxidants like blueberries and green tea. Limit screen time and practice mindfulness. Image: [image of blueberries],,,,,,,,,,,,,,,,,,,
70,Consult a healthcare professional for a detailed plan. Incorporate restorative hair treatments like PRP therapy. Increase your intake of fiber and plant-based foods. Seek therapy for emotional well-being. Image: [image of PRP therapy],,,,,,,,,,,,,,,,,,,
75,Look into medical treatments like hair transplants. Keep your scalp clean and healthy with regular treatments. Increase your intake of protein-rich foods and omega-3s. Practice self-care and relaxation regularly. Image: [image of hair transplant],,,,,,,,,,,,,,,,,,,
80,"Hair transplant may be a recommended option. Ensure proper nutrition with a focus on lean proteins, whole grains, and vegetables. Take steps to reduce daily stress through activities like meditation. Image: [image of leafy greens]",,,,,,,,,,,,,,,,,,,
85,Seek professional help for advanced treatments such as laser therapy. Use natural oils for deep nourishment. Include anti-inflammatory foods like ginger and turmeric in your diet. Focus on overall well-being. Image: [image of ginger],,,,,,,,,,,,,,,,,,,
90,"Consider multiple treatments like laser therapy, PRP, and hair transplant. Include iron-rich foods like red meat and leafy greens. Maintain regular sleep and a balanced lifestyle. Image: [image of red meat]",,,,,,,,,,,,,,,,,,,
95,"Advanced treatments are necessary, including consultations with top specialists. Focus on vitamins and minerals for hair regrowth. Avoid stress and incorporate relaxation techniques into your daily routine. Image: [image of stress-relief activities]",,,,,,,,,,,,,,,,,,,
100,"Seek urgent professional treatment. Consider a combination of medical and cosmetic solutions for hair restoration. Focus on high-quality proteins, vitamins, and fatty acids. Seek emotional support if needed. Image: [image of a clinic or hair restoration clinic]",,,,,,,,,,,,,,,,,,,
,,,,,,,,,,,,,,,,,,,,
